{
  "article_paths": [
    "articles/2026/09/01/itm_7537ec387c4c5528/index.md"
  ],
  "category_counts": {
    "ai-safety": 1
  },
  "config_path": "config/automation/codex-hourly.zh.json",
  "date_window": {
    "max_age_days": 7,
    "mode": "today_or_current_week",
    "timezone": "Asia/Shanghai"
  },
  "dedupe": {
    "checked_keys": [
      "canonical_url",
      "external_id",
      "title_hash",
      "content_hash"
    ],
    "duplicate_candidates": 0,
    "ledger_path": "public/index/known-links.json",
    "replacement_candidates": 0
  },
  "generated_at": "2026-09-07T15:33:30Z",
  "quality_gate": {
    "evidence_points": 13,
    "image_notes": 1,
    "minimum_chinese_chars": 5000,
    "passed": true,
    "skeptical_review": 7,
    "third_party_references": 2
  },
  "run_id": "codex-hourly-20260907t152108940995000z",
  "status": "complete",
  "sub_agent_reviews": [
    {
      "agent_id": "scout",
      "status": "passed",
      "summary": "Single merged Scout returned a unified table across llm-agent, llm-post-training, and ai-safety; Agent Memory / EAL-Bench was the top recommendation."
    },
    {
      "agent_id": "deep_reader",
      "status": "passed",
      "summary": "Main agent read arXiv HTML, official abstract metadata, GitHub README, repository structure, result tables, domain design, and mitigation appendices."
    },
    {
      "agent_id": "skeptic",
      "status": "passed",
      "summary": "Preserved boundaries on synthetic histories, closed-world ledger, scored tools, Finance raw artifact gap, and local validate-only import-boundary failure."
    }
  ],
  "version": 1,
  "written_item_ids": [
    "itm_7537ec387c4c5528"
  ]
}
