{
  "article_paths": [
    "articles/2026/09/03/itm_5650e2c57c526ceb/index.md"
  ],
  "category_counts": {
    "ai-safety": 1
  },
  "config_path": "config/automation/codex-hourly.zh.json",
  "date_window": {
    "max_age_days": 7,
    "mode": "today_or_current_week",
    "timezone": "Asia/Shanghai"
  },
  "dedupe": {
    "checked_keys": [
      "canonical_url",
      "external_id",
      "title_hash",
      "content_hash"
    ],
    "duplicate_candidates": 1,
    "ledger_path": "public/index/known-links.json",
    "replacement_candidates": 1
  },
  "generated_at": "2026-09-07T10:30:30Z",
  "quality_gate": {
    "evidence_points": 12,
    "image_notes": 0,
    "minimum_chinese_chars": 5000,
    "passed": true,
    "skeptical_review": 4,
    "third_party_references": 0
  },
  "run_id": "codex-hourly-20260907t092420187680000z",
  "status": "complete",
  "sub_agent_reviews": [
    {
      "agent_id": "scout",
      "status": "passed",
      "summary": "Single merged Scout covered llm-agent, llm-post-training, and ai-safety. Its first recommendation CUA-Universe was already live in current origin/data, so main agent pivoted within the same table to Repeat-After-Me."
    },
    {
      "agent_id": "skeptic",
      "status": "passed",
      "summary": "The article treats prompt-injection content as defensive research, avoids reproducing operational attack strings, and records query-cost, role-placement, synthetic-data, and defense-adaptation limits."
    },
    {
      "agent_id": "related_work",
      "status": "passed",
      "summary": "Reference search found no independent third-party replication; article uses arXiv HTML/source as primary evidence and frames prior visual-injection work through the paper's comparison table."
    }
  ],
  "version": 1,
  "written_item_ids": [
    "itm_5650e2c57c526ceb"
  ]
}
