{
  "article_paths": [
    "articles/2026/08/17/itm_2f60ab2fa7499677/index.md"
  ],
  "category_counts": {
    "ai-safety": 1
  },
  "config_path": "config/automation/codex-hourly.zh.json",
  "date_window": {
    "max_age_days": 7,
    "mode": "today_or_current_week",
    "timezone": "Asia/Shanghai"
  },
  "dedupe": {
    "checked_keys": [
      "canonical_url",
      "external_id",
      "title_hash",
      "content_hash"
    ],
    "duplicate_candidates": 0,
    "ledger_path": "public/index/known-links.json",
    "replacement_candidates": 0
  },
  "generated_at": "2026-08-17T00:12:10Z",
  "quality_gate": {
    "evidence_points": 5,
    "image_notes": 0,
    "minimum_chinese_chars": 5000,
    "passed": true,
    "skeptical_review": 5,
    "third_party_references": 5
  },
  "run_id": "hourly-20260817t001210z",
  "status": "complete",
  "sub_agent_reviews": [
    {
      "agent_id": "scout",
      "status": "passed",
      "summary": "唯一 Scout 覆盖 llm-agent、llm-post-training、ai-safety，给出统一候选表并推荐 TOP1。"
    },
    {
      "agent_id": "deep_reader",
      "status": "passed",
      "summary": "主 Agent 深读候选项目 README、registry、generated tables、实验代码与证据边界。"
    },
    {
      "agent_id": "method_or_code_analyst",
      "status": "passed",
      "summary": "正文解释 paired same-checkpoint、raw margin、tie-aware AP、matched-FPR 与 KL-SFT。"
    },
    {
      "agent_id": "skeptic",
      "status": "passed",
      "summary": "正文明确区分 GitHub 当日更新、retrospective evidence、gated data 与 contract drift。"
    },
    {
      "agent_id": "related_work",
      "status": "passed",
      "summary": "正文纳入 GuardReasoner、AIMS、DT-Guard、Agent runtime safety 的边界比较。"
    },
    {
      "agent_id": "markdown_editor",
      "status": "passed",
      "summary": "正文采用 h3、表格、公式解释块、伪代码和 Mermaid，CJK 计数达到 5133。"
    }
  ],
  "version": 1,
  "written_item_ids": [
    "itm_2f60ab2fa7499677"
  ]
}
