{
  "article_paths": [
    "articles/2026/10/12/itm_9b99dac7607853de/index.md"
  ],
  "category_counts": {
    "llm-post-training": 1
  },
  "config_path": "config/automation/codex-hourly.zh.json",
  "date_window": {
    "max_age_days": 7,
    "mode": "today_or_current_week",
    "timezone": "Asia/Shanghai"
  },
  "dedupe": {
    "checked_keys": [
      "canonical_url",
      "external_id",
      "title_hash",
      "content_hash"
    ],
    "duplicate_candidates": 0,
    "ledger_path": "public/index/known-links.json",
    "replacement_candidates": 4
  },
  "generated_at": "2026-10-15T02:45:01Z",
  "quality_gate": {
    "evidence_points": 2,
    "image_notes": 0,
    "minimum_chinese_chars": 5000,
    "passed": true,
    "skeptical_review": 3,
    "third_party_references": 0
  },
  "run_id": "codex-hourly-20261015t024501z",
  "status": "complete",
  "sub_agent_reviews": [
    {
      "agent_id": "scout",
      "status": "passed",
      "summary": "单一 Scout 覆盖 Agent、后训练与 AI 安全，确认 WildTrace 在本周窗口内且不在已知重复项中。"
    }
  ],
  "version": 1,
  "written_item_ids": [
    "itm_9b99dac7607853de"
  ]
}
