{
  "article_paths": [
    "articles/2026/07/26/itm_6ce21481a19e5f28/index.md"
  ],
  "category_counts": {
    "llm-agent": 1
  },
  "config_path": "config/automation/codex-hourly.zh.json",
  "date_window": {
    "max_age_days": 7,
    "mode": "today_or_current_week",
    "timezone": "Asia/Shanghai"
  },
  "dedupe": {
    "checked_keys": [
      "canonical_url",
      "external_id",
      "title_hash",
      "content_hash"
    ],
    "duplicate_candidates": 0,
    "ledger_path": "public/index/known-links.json",
    "replacement_candidates": 0
  },
  "generated_at": "2026-07-26T05:41:12Z",
  "quality_gate": {
    "evidence_points": 4,
    "image_notes": 0,
    "minimum_chinese_chars": 5000,
    "passed": true,
    "skeptical_review": 4,
    "third_party_references": 3
  },
  "run_id": "20260726t054112z",
  "status": "complete",
  "sub_agent_reviews": [
    {
      "agent_id": "scout",
      "status": "passed",
      "summary": "唯一 Scout 覆盖 llm-agent、llm-post-training、ai-safety 三类；重复项换题后本轮选择 arXiv:2607.18754。"
    },
    {
      "agent_id": "deep_reader",
      "status": "passed",
      "summary": "已阅读 arXiv 摘要、HTML 正文、评测协议、部署要求、项目 README 和 PyPI 元信息。"
    },
    {
      "agent_id": "method_or_code_analyst",
      "status": "passed",
      "summary": "正文拆解 portable trace、DeepDebug 四阶段、闭环 rerun、Error Hub 和工程目录。"
    },
    {
      "agent_id": "skeptic",
      "status": "passed",
      "summary": "正文明确归因准确率仍低、trace 完整度依赖、rerun runner 和脱敏边界。"
    },
    {
      "agent_id": "related_work",
      "status": "passed",
      "summary": "外部参考覆盖 AgentDebugX 项目、PyPI、Who&When、GAIA、OpenTelemetry 和 self-correction 相关线索。"
    },
    {
      "agent_id": "markdown_editor",
      "status": "passed",
      "summary": "正文使用 h3、表格、公式解释、伪代码和分点结构，避免连续大段纯文本。"
    }
  ],
  "version": 1,
  "written_item_ids": [
    "itm_6ce21481a19e5f28"
  ]
}
