{
  "article_paths": [
    "articles/2026/08/18/itm_c9f588cc60059924/index.md"
  ],
  "category_counts": {
    "ai-safety": 1
  },
  "config_path": "config/automation/codex-hourly.zh.json",
  "date_window": {
    "max_age_days": 7,
    "mode": "today_or_current_week",
    "timezone": "Asia/Shanghai"
  },
  "dedupe": {
    "checked_keys": [
      "canonical_url",
      "external_id",
      "title_hash",
      "content_hash"
    ],
    "duplicate_candidates": 3,
    "ledger_path": "public/index/known-links.json",
    "replacement_candidates": 0
  },
  "generated_at": "2026-08-18T18:18:17Z",
  "quality_gate": {
    "evidence_points": 6,
    "image_notes": 0,
    "minimum_chinese_chars": 5000,
    "passed": true,
    "skeptical_review": 5,
    "third_party_references": 6
  },
  "run_id": "codex-hourly-20260818t18181787077112z",
  "status": "complete",
  "sub_agent_reviews": [
    {
      "agent_id": "scout",
      "status": "passed",
      "summary": "唯一 Scout 一次性覆盖三类方向，输出统一候选表；已避开 Le Critique、ClawGym II 和 multi-agent coding 等重复候选。"
    },
    {
      "agent_id": "deep_reader",
      "status": "passed",
      "summary": "主 Agent 深读 arXiv HTML、PDF、API、A.I.G README、研究子目录、adapter、driver、dataset 与 aggregate results。"
    },
    {
      "agent_id": "method_or_code_analyst",
      "status": "passed",
      "summary": "正文拆解 A.I.G source-to-sink pipeline、DSH runtime adapter、RuleJudge/LLMJudge、text/file carrier 和 source/sink fixture。"
    },
    {
      "agent_id": "skeptic",
      "status": "passed",
      "summary": "正文保留单一 runtime snapshot、单一模型后端、simulated sinks、sanitized artifacts 和未比较防御策略等证据边界。"
    },
    {
      "agent_id": "related_work",
      "status": "passed",
      "summary": "正文对照 indirect prompt injection、AgentDojo/InjecAgent、prompt-boundary defenses、agent memory/assets 等相关方向。"
    },
    {
      "agent_id": "markdown_editor",
      "status": "passed",
      "summary": "正文为纯 Markdown，包含自包含 TL;DR、多级分点、表格、公式说明和 Mermaid，CJK 计数超过 5000。"
    }
  ],
  "version": 1,
  "written_item_ids": [
    "itm_c9f588cc60059924"
  ]
}
