{
  "article_paths": [
    "articles/2026/06/16/itm_b7c55fa783d2165e/index.md"
  ],
  "category_counts": {
    "llm-agent": 1
  },
  "config_path": "config/automation/codex-hourly.zh.json",
  "date_window": {
    "max_age_days": 7,
    "mode": "today_or_current_week",
    "timezone": "Asia/Shanghai"
  },
  "dedupe": {
    "checked_keys": [
      "canonical_url",
      "external_id",
      "title_hash",
      "content_hash"
    ],
    "duplicate_candidates": 0,
    "ledger_path": "public/index/known-links.json",
    "replacement_candidates": 0
  },
  "generated_at": "2026-06-17T17:51:13Z",
  "quality_gate": {
    "evidence_points": 4,
    "image_notes": 0,
    "minimum_chinese_chars": 5000,
    "passed": true,
    "skeptical_review": 5,
    "third_party_references": 1
  },
  "run_id": "codex-hourly-20260618t051801z",
  "status": "complete",
  "sub_agent_reviews": [
    {
      "agent_id": "scout",
      "status": "passed",
      "summary": "Hash repair only; original run used one unified Scout attempt followed by one merged manual candidate pass."
    }
  ],
  "version": 1,
  "written_item_ids": [
    "itm_b7c55fa783d2165e"
  ]
}
