{
  "article_paths": [
    "articles/2026/07/19/itm_b373fca8f6d79fa4/index.md"
  ],
  "category_counts": {
    "llm-post-training": 1
  },
  "config_path": "config/automation/codex-hourly.zh.json",
  "date_window": {
    "max_age_days": 7,
    "mode": "today_or_current_week",
    "timezone": "Asia/Shanghai"
  },
  "dedupe": {
    "checked_keys": [
      "canonical_url",
      "external_id",
      "title_hash",
      "content_hash"
    ],
    "duplicate_candidates": 2,
    "ledger_path": "public/index/known-links.json",
    "replacement_candidates": 1
  },
  "generated_at": "2026-07-19T22:23:54Z",
  "quality_gate": {
    "evidence_points": 4,
    "image_notes": 0,
    "minimum_chinese_chars": 5000,
    "passed": true,
    "skeptical_review": 4,
    "third_party_references": 1
  },
  "run_id": "codex-hourly-20260719t22191784499566z",
  "status": "complete",
  "sub_agent_reviews": [
    {
      "agent_id": "scout",
      "status": "passed",
      "summary": "Single merged Scout covered llm-agent, llm-post-training, and ai-safety for the current-week window, surfaced 11 dated candidates, and provided the replacement table used after OmniaBench and PRISM were found duplicated."
    }
  ],
  "version": 1,
  "written_item_ids": [
    "itm_b373fca8f6d79fa4"
  ]
}
