{
  "article_paths": [
    "articles/2026/07/02/itm_fc3acfdee05b138b/index.md"
  ],
  "category_counts": {
    "ai-safety": 1
  },
  "config_path": "config/automation/codex-hourly.zh.json",
  "date_window": {
    "max_age_days": 7,
    "mode": "today_or_current_week",
    "timezone": "Asia/Shanghai"
  },
  "dedupe": {
    "checked_keys": [
      "canonical_url",
      "external_id",
      "title_hash",
      "content_hash"
    ],
    "duplicate_candidates": 1,
    "ledger_path": "public/index/known-links.json",
    "replacement_candidates": 0
  },
  "generated_at": "2026-07-05T13:31:19Z",
  "quality_gate": {
    "evidence_points": 10,
    "image_notes": 0,
    "minimum_chinese_chars": 5000,
    "passed": true,
    "skeptical_review": 4,
    "third_party_references": 2
  },
  "run_id": "codex-hourly-20260705t133119z-mastermind",
  "status": "complete",
  "sub_agent_reviews": [
    {
      "agent_id": "scout",
      "status": "passed",
      "summary": "One merged Scout covered llm-agent, llm-post-training, and ai-safety. Mastermind ranked first with verified arXiv timestamp, low exact-duplicate risk, and strong overlap across security, agent execution, and strategy-level post-training."
    }
  ],
  "version": 1,
  "written_item_ids": [
    "itm_fc3acfdee05b138b"
  ]
}
