{
  "article_paths": [
    "articles/2026/06/16/itm_d60d2e5796360757/index.md"
  ],
  "category_counts": {
    "llm-agent": 1
  },
  "config_path": "config/automation/codex-hourly.zh.json",
  "date_window": {
    "max_age_days": 7,
    "mode": "today_or_current_week",
    "timezone": "Asia/Shanghai"
  },
  "dedupe": {
    "checked_keys": [
      "canonical_url",
      "external_id",
      "title_hash",
      "content_hash"
    ],
    "duplicate_candidates": 0,
    "ledger_path": "public/index/known-links.json",
    "replacement_candidates": 0
  },
  "generated_at": "2026-06-16T02:47:26Z",
  "quality_gate": {
    "evidence_points": 5,
    "image_notes": 0,
    "minimum_chinese_chars": 5000,
    "passed": true,
    "skeptical_review": 4,
    "third_party_references": 5
  },
  "run_id": "codex-hourly-20260616t024726z",
  "status": "complete",
  "sub_agent_reviews": [
    {
      "agent_id": "scout",
      "status": "passed",
      "summary": "One unified Scout covered llm-agent, llm-post-training, and ai-safety candidates; User as Code ranked first for artifact depth and current-week freshness."
    },
    {
      "agent_id": "deep_reader",
      "status": "passed",
      "summary": "Main agent read arXiv page, HTML/TeX source, PDF artifact, repository README, experiment guide, evaluation protocol, and prototype notes."
    },
    {
      "agent_id": "markdown_editor",
      "status": "passed",
      "summary": "Article exceeds 5000 Chinese characters and uses tables, formula blocks, pseudocode, and Mermaid without external image references."
    }
  ],
  "version": 1,
  "written_item_ids": [
    "itm_d60d2e5796360757"
  ]
}
