{
  "article_paths": [
    "articles/2026/06/13/itm_88d3ee8205e0391e/index.md"
  ],
  "category_counts": {
    "llm-agent": 1
  },
  "config_path": "config/automation/codex-hourly.zh.json",
  "date_window": {
    "max_age_days": 7,
    "mode": "today_or_current_week",
    "timezone": "Asia/Shanghai"
  },
  "dedupe": {
    "checked_keys": [
      "canonical_url",
      "external_id",
      "title_hash",
      "content_hash"
    ],
    "duplicate_candidates": 0,
    "ledger_path": "public/index/known-links.json",
    "replacement_candidates": 0
  },
  "generated_at": "2026-06-12T20:38:16Z",
  "quality_gate": {
    "evidence_points": 5,
    "image_notes": 2,
    "minimum_chinese_chars": 5000,
    "passed": true,
    "skeptical_review": 4,
    "third_party_references": 3
  },
  "run_id": "codex-hourly-20260612t203816z",
  "status": "complete",
  "sub_agent_reviews": [
    {
      "agent_id": "scout",
      "status": "passed",
      "summary": "One Scout covered llm-agent, llm-post-training, and ai-safety in a unified table; EvoArena selected after dedupe against recent items."
    },
    {
      "agent_id": "deep_reader",
      "status": "passed",
      "summary": "Read arXiv abstract, TeX source, project page, GitHub README, and Hugging Face paper/dataset metadata."
    },
    {
      "agent_id": "markdown_editor",
      "status": "passed",
      "summary": "Article uses headings, tables, formulas, pseudocode, local images, mechanism analysis, and explicit limitations."
    },
    {
      "agent_id": "skeptic",
      "status": "passed",
      "summary": "Marked progressive-release repository status, missing final license, incomplete aggregate dataset availability, and non-monotonic model gains."
    }
  ],
  "version": 1,
  "written_item_ids": [
    "itm_88d3ee8205e0391e"
  ]
}
