{
  "article_paths": [
    "articles/2026/07/02/itm_937a36b8a2a87500/index.md"
  ],
  "category_counts": {
    "llm-agent": 1
  },
  "config_path": "config/automation/codex-hourly.zh.json",
  "date_window": {
    "max_age_days": 7,
    "mode": "today_or_current_week",
    "timezone": "Asia/Shanghai"
  },
  "dedupe": {
    "checked_keys": [
      "canonical_url",
      "external_id",
      "title_hash",
      "content_hash"
    ],
    "duplicate_candidates": 1,
    "ledger_path": "public/index/known-links.json",
    "replacement_candidates": 1
  },
  "generated_at": "2026-07-02T19:09:09Z",
  "quality_gate": {
    "evidence_points": 3,
    "image_notes": 0,
    "minimum_chinese_chars": 5000,
    "passed": true,
    "skeptical_review": 5,
    "third_party_references": 0
  },
  "run_id": "codex-hourly-20260702t190909z",
  "status": "complete",
  "sub_agent_reviews": [
    {
      "agent_id": "scout",
      "status": "passed",
      "summary": "Single unified Scout searched llm-agent, llm-post-training, and ai-safety in one table; AutoMem was selected first but origin/data advanced with AutoMem, so main agent pivoted inside the same Scout table to RepoRescue after exact title/arXiv-id dedupe cleared."
    }
  ],
  "version": 1,
  "written_item_ids": [
    "itm_937a36b8a2a87500"
  ]
}
