{
  "article_paths": [
    "articles/2026/06/28/itm_8bb57ba2a745fec4/index.md"
  ],
  "category_counts": {
    "llm-agent": 1
  },
  "config_path": "config/automation/codex-hourly.zh.json",
  "date_window": {
    "max_age_days": 7,
    "mode": "today_or_current_week",
    "timezone": "Asia/Shanghai"
  },
  "dedupe": {
    "checked_keys": [
      "canonical_url",
      "external_id",
      "title_hash",
      "content_hash"
    ],
    "duplicate_candidates": 3,
    "ledger_path": "public/index/known-links.json",
    "replacement_candidates": 10
  },
  "generated_at": "2026-06-28T13:03:52Z",
  "quality_gate": {
    "evidence_points": 14,
    "image_notes": 0,
    "minimum_chinese_chars": 5000,
    "passed": true,
    "skeptical_review": 4,
    "third_party_references": 3
  },
  "run_id": "codex-hourly-20260628t122300z",
  "status": "complete",
  "sub_agent_reviews": [
    {
      "agent_id": "scout",
      "status": "passed",
      "summary": "Single merged Scout covered all three categories; OPID was selected after remote PEEU duplicate appeared."
    }
  ],
  "version": 1,
  "written_item_ids": [
    "itm_8bb57ba2a745fec4"
  ]
}
