{
  "article_paths": [
    "articles/2026/06/11/itm_c98e43e588156c5a/index.md"
  ],
  "category_counts": {
    "llm-post-training": 1
  },
  "config_path": "config/automation/codex-hourly.zh.json",
  "date_window": {
    "max_age_days": 7,
    "mode": "today_or_current_week",
    "timezone": "Asia/Shanghai"
  },
  "dedupe": {
    "checked_keys": [
      "canonical_url",
      "external_id",
      "title_hash",
      "content_hash"
    ],
    "duplicate_candidates": 0,
    "ledger_path": "public/index/known-links.json",
    "replacement_candidates": 0
  },
  "generated_at": "2026-06-11T08:37:07Z",
  "quality_gate": {
    "evidence_points": 3,
    "image_notes": 0,
    "minimum_chinese_chars": 5000,
    "passed": true,
    "skeptical_review": 3,
    "third_party_references": 1
  },
  "run_id": "codex-hourly-20260611t083707z",
  "status": "complete",
  "sub_agent_reviews": [
    {
      "agent_id": "scout",
      "status": "passed",
      "summary": "Single Scout covered llm-agent, llm-post-training, and ai-safety; APPO was selected from a unified current-week table."
    },
    {
      "agent_id": "deep_reader",
      "status": "passed",
      "summary": "Read arXiv abstract, HTML full text, appendix, and official GitHub README before writing the Markdown analysis."
    },
    {
      "agent_id": "markdown_editor",
      "status": "passed",
      "summary": "Article uses Markdown tables, formulas, pseudocode, and Mermaid without external image URLs."
    }
  ],
  "version": 1,
  "written_item_ids": [
    "itm_c98e43e588156c5a"
  ]
}
