{
  "article_paths": [
    "articles/2026/08/13/itm_eb5202c1bef78dc3/index.md"
  ],
  "category_counts": {
    "ai-safety": 1
  },
  "config_path": "config/automation/codex-hourly.zh.json",
  "date_window": {
    "max_age_days": 7,
    "mode": "today_or_current_week",
    "timezone": "Asia/Shanghai"
  },
  "dedupe": {
    "checked_keys": [
      "canonical_url",
      "external_id",
      "title_hash",
      "content_hash"
    ],
    "duplicate_candidates": 3,
    "ledger_path": "public/index/known-links.json",
    "replacement_candidates": 1
  },
  "generated_at": "2026-08-16T16:30:07Z",
  "quality_gate": {
    "evidence_points": 4,
    "image_notes": 0,
    "minimum_chinese_chars": 5000,
    "passed": true,
    "skeptical_review": 4,
    "third_party_references": 3
  },
  "run_id": "codex-hourly-20260816t163007z",
  "status": "complete",
  "sub_agent_reviews": [
    {
      "agent_id": "scout",
      "status": "passed",
      "summary": "唯一 Scout 一次性覆盖 llm-agent、llm-post-training、ai-safety 三类；WIFA、Vero、CrEST 命中当前账本重复后，主 Agent 在同表 pivot 到 arXiv:2608.13450v1。"
    },
    {
      "agent_id": "deep_reader",
      "status": "passed",
      "summary": "已阅读 arXiv abstract、HTML 全文、PDF 入口与关键表图，正文按研究问题、方法、实验、结果、局限展开。"
    },
    {
      "agent_id": "method_or_code_analyst",
      "status": "passed",
      "summary": "正文拆解静态分析、740-target census、LLM artifact generation、compiler-in-loop repair、linked/fuzzed attrition 和 stub convergence。"
    },
    {
      "agent_id": "skeptic",
      "status": "passed",
      "summary": "正文明确 0 confirmed 不等于 0 risk，并区分 compileability、linking、target reachability、false positive 和 disconfirmation。"
    },
    {
      "agent_id": "related_work",
      "status": "passed",
      "summary": "检索第三方索引和自动摘要站点，未发现作者额外技术博客或公开 GitHub artifact 页面。"
    },
    {
      "agent_id": "markdown_editor",
      "status": "passed",
      "summary": "正文为纯 Markdown，包含 TL;DR、表格、公式块、Mermaid 和伪代码；未引用外部图片 URL。"
    }
  ],
  "version": 1,
  "written_item_ids": [
    "itm_eb5202c1bef78dc3"
  ]
}
