{
  "article_paths": [
    "articles/2026/06/07/itm_25cdea8ffbbe90fd/index.md"
  ],
  "category_counts": {
    "llm-agent": 1
  },
  "config_path": "config/automation/codex-hourly.zh.json",
  "date_window": {
    "max_age_days": 7,
    "mode": "today_or_current_week",
    "timezone": "Asia/Shanghai"
  },
  "dedupe": {
    "checked_keys": [
      "canonical_url",
      "external_id",
      "title_hash",
      "content_hash"
    ],
    "duplicate_candidates": 1,
    "ledger_path": "public/index/known-links.json",
    "replacement_candidates": 1
  },
  "generated_at": "2026-06-06T23:41:31Z",
  "quality_gate": {
    "evidence_points": 4,
    "image_notes": 4,
    "minimum_chinese_chars": 5080,
    "passed": true,
    "skeptical_review": 5,
    "third_party_references": 3
  },
  "run_id": "codex-hourly-20260606t234131z",
  "status": "complete",
  "sub_agent_reviews": [
    {
      "agent_id": "scout",
      "status": "passed",
      "summary": "唯一 Scout 一次性覆盖大模型 Agent、后训练、AI 安全三类，返回 11 个本周候选；OpenWebRL 已在现有 items 中命中，主 Agent 选 Harness-1 作为同类替代。"
    },
    {
      "agent_id": "deep_reader",
      "status": "passed",
      "summary": "主 Agent 深读 arXiv PDF、GitHub README、vLLM/Tinker 推理文档和模型卡，抽取状态设计、reward、SFT/RL 设置、主结果与消融。"
    },
    {
      "agent_id": "method_or_code_analyst",
      "status": "passed",
      "summary": "正文覆盖 WORKINGMEMORY、candidate pool、curated set、evidence graph、verification cache、tool signatures、vLLM raw completions 复现边界。"
    },
    {
      "agent_id": "related_work",
      "status": "passed",
      "summary": "正文对比 Context-1、Search-R1/WebSeer 类搜索 RL，并说明 Harness-1 的 stateful interface 差异。"
    },
    {
      "agent_id": "skeptic",
      "status": "passed",
      "summary": "正文列出 Chroma/OpenAI/reranker 依赖、regex evidence graph、qrels 近重复、verify 错误传播和硬件门槛等局限。"
    },
    {
      "agent_id": "markdown_editor",
      "status": "passed",
      "summary": "正文纯 Markdown，含 h3 小节、列表、表格、公式块、Mermaid 和 4 张本地化图片，无外链图片语法。"
    }
  ],
  "version": 1,
  "written_item_ids": [
    "itm_25cdea8ffbbe90fd"
  ]
}
