{
  "article_paths": [
    "articles/2026/08/11/itm_bb972b76f25d65f4/index.md"
  ],
  "category_counts": {
    "llm-post-training": 1
  },
  "config_path": "config/automation/codex-hourly.zh.json",
  "date_window": {
    "max_age_days": 7,
    "mode": "today_or_current_week",
    "timezone": "Asia/Shanghai"
  },
  "dedupe": {
    "checked_keys": [
      "canonical_url",
      "external_id",
      "title_hash",
      "content_hash"
    ],
    "duplicate_candidates": 0,
    "ledger_path": "public/index/known-links.json",
    "replacement_candidates": 1
  },
  "generated_at": "2026-08-11T07:21:19Z",
  "quality_gate": {
    "evidence_points": 6,
    "image_notes": 0,
    "minimum_chinese_chars": 5000,
    "passed": true,
    "skeptical_review": 8,
    "third_party_references": 3
  },
  "run_id": "codex-hourly-20260811t072119z",
  "status": "complete",
  "sub_agent_reviews": [
    {
      "agent_id": "scout",
      "status": "passed",
      "summary": "One merged Scout searched all three configured categories and recommended TRIAL as the strongest post-training/agentic RL candidate."
    },
    {
      "agent_id": "deep_reader",
      "status": "passed",
      "summary": "Main Agent read the arXiv PDF through pypdf extraction, checked official code scripts, and wrote a Chinese Markdown deep read above 5000 CJK characters."
    },
    {
      "agent_id": "skeptic",
      "status": "passed",
      "summary": "The article separates GRPO complementarity, trajectory-relative allocation evidence, Uniform/Permuted controls, single-seed limits, and outcome-view migration risks."
    }
  ],
  "version": 1,
  "written_item_ids": [
    "itm_bb972b76f25d65f4"
  ]
}
