{
  "article_paths": [
    "articles/2026/06/09/itm_355af50736cd43c8/index.md"
  ],
  "category_counts": {
    "ai-safety": 1
  },
  "config_path": "config/automation/codex-hourly.zh.json",
  "date_window": {
    "max_age_days": 7,
    "mode": "today_or_current_week",
    "timezone": "Asia/Shanghai"
  },
  "dedupe": {
    "checked_keys": [
      "canonical_url",
      "external_id",
      "title_hash",
      "content_hash"
    ],
    "duplicate_candidates": 1,
    "ledger_path": "public/index/known-links.json",
    "replacement_candidates": 1
  },
  "generated_at": "2026-06-16T08:50:53Z",
  "quality_gate": {
    "evidence_points": 3,
    "image_notes": 0,
    "minimum_chinese_chars": 5000,
    "passed": true,
    "skeptical_review": 3,
    "third_party_references": 1
  },
  "run_id": "codex-hourly-20260616t085053z",
  "status": "complete",
  "sub_agent_reviews": [
    {
      "agent_id": "scout",
      "status": "passed",
      "summary": "Unified Scout covered llm-agent, llm-post-training and ai-safety; selected replacement after first candidate duplicated."
    },
    {
      "agent_id": "deep_reader",
      "status": "passed",
      "summary": "Main agent read arXiv abstract, HTML and source TeX, then wrote a 5000+ Chinese-character Markdown analysis."
    },
    {
      "agent_id": "markdown_editor",
      "status": "passed",
      "summary": "Article uses headings, lists, tables, formulas and Mermaid; no external image URLs are embedded."
    }
  ],
  "version": 1,
  "written_item_ids": [
    "itm_355af50736cd43c8"
  ]
}
