{
  "article_paths": [
    "articles/2026/07/27/itm_127b808f16db7bdc/index.md"
  ],
  "category_counts": {
    "llm-post-training": 1
  },
  "config_path": "config/automation/codex-hourly.zh.json",
  "date_window": {
    "max_age_days": 7,
    "mode": "today_or_current_week",
    "timezone": "Asia/Shanghai"
  },
  "dedupe": {
    "checked_keys": [
      "canonical_url",
      "external_id",
      "title_hash",
      "content_hash"
    ],
    "duplicate_candidates": 1,
    "ledger_path": "public/index/known-links.json",
    "replacement_candidates": 1
  },
  "generated_at": "2026-07-27T17:58:32Z",
  "quality_gate": {
    "evidence_points": 5,
    "image_notes": 1,
    "minimum_chinese_chars": 5000,
    "passed": true,
    "skeptical_review": 4,
    "third_party_references": 1
  },
  "run_id": "codex-hourly-20260727t175832z",
  "status": "complete",
  "sub_agent_reviews": [
    {
      "agent_id": "scout",
      "status": "passed",
      "summary": "Single Scout searched llm-agent, llm-post-training, and ai-safety together; Molt was selected after the top Skill Self-Play row was found to be already live."
    }
  ],
  "version": 1,
  "written_item_ids": [
    "itm_127b808f16db7bdc"
  ]
}
